<?xml version="1.0" encoding="UTF-8"?>
<xs:schema xmlns:xs="http://www.w3.org/2001/XMLSchema">
	<xs:simpleType name="ST_abbr">
		<xs:restriction base="xs:string"/>
	</xs:simpleType>
	<xs:element name="name">
		<xs:simpleType>
			<xs:restriction base="xs:string"/>
		</xs:simpleType>
	</xs:element>
	<xs:element name="id">
		<xs:simpleType>
			<xs:restriction base="xs:string"/>
		</xs:simpleType>
	</xs:element>
	<xs:element name="collection">
		<xs:complexType>
			<xs:sequence>
				<xs:element ref="book" maxOccurs="unbounded"/>
			</xs:sequence>
		</xs:complexType>
	</xs:element>
	<xs:element name="book">
		<xs:complexType>
			<xs:sequence>
				<xs:element ref="id"/>
				<xs:element ref="abbr" minOccurs="0" maxOccurs="unbounded"/>
				<xs:element ref="name" maxOccurs="unbounded"/>
			</xs:sequence>
		</xs:complexType>
	</xs:element>
	<xs:element name="abbr">
		<xs:complexType>
			<xs:simpleContent>
				<xs:extension base="ST_abbr">
					<xs:attribute name="mode">
						<xs:simpleType>
							<xs:restriction base="xs:string"/>
						</xs:simpleType>
					</xs:attribute>
				</xs:extension>
			</xs:simpleContent>
		</xs:complexType>
	</xs:element>
</xs:schema>
