<?xml version="1.0" encoding="UTF-8"?>
<collection xmlns:xsi="http://www.w3.org/2001/XMLSchema-instance" xsi:noNamespaceSchemaLocation="canon.xsd">
<!-- Collection name: qumran -->


	<!-- Qumran Scrolls -->

	<book>
		<id>1QGen</id>
		<name>1Q1</name>
	</book>
	<book>
		<id>1QEx</id>
		<name>1Q2</name>
	</book>
	<book>
		<id>1QpaleoLev</id>
		<name>1Q3</name>
	</book>
	<book>
		<id>1QDeuta</id>
		<name>1Q4</name>
	</book>
	<book>
		<id>1QDeutb</id>
		<name>1Q5</name>
	</book>
	<book>
		<id>1QJudg</id>
		<name>1Q6</name>
	</book>
	<book>
		<id>1QSam</id>
		<name>1Q7</name>
	</book>
	<book>
		<id>1QIsab</id>
		<name>1Q8</name>
	</book>
	<book>
		<id>1QEzek</id>
		<name>1Q9</name>
	</book>
	<book>
		<id>1QPsa</id>
		<name>1Q10</name>
	</book>
	<book>
		<id>1QPsb</id>
		<name>1Q11</name>
	</book>
	<book>
		<id>1QPsc</id>
		<name>1Q12</name>
	</book>
	<book>
		<id>1Qphyl</id>
		<name>1Q13</name>
	</book>
	<book>
		<id>1QpMic</id>
		<name>1Q14</name>
	</book>
	<book>
		<id>1QpZeph</id>
		<name>1Q15</name>
	</book>
	<book>
		<id>1QpPs</id>
		<name>1Q16</name>
	</book>
	<book>
		<id>1QJuba</id>
		<name>1Q17</name>
	</book>
	<book>
		<id>1QJubb</id>
		<name>1Q18</name>
	</book>
	<book>
		<id>1QNoah</id>
		<name>1Q19</name>
		<name>1Q19bis</name>
	</book>
	<book>
		<id>1QapGen</id>
		<name>1Q20</name>
	</book>
	<book>
		<id>1QTLeviar</id>
		<name>1Q21</name>
	</book>
	<book>
		<id>1QDM</id>
		<name>1Q22</name>
	</book>
	<book>
		<id>1QEnGiants</id>
		<name>1Q23</name>
		<name>1Q24</name>
	</book>
	<book>
		<id>1QMyst</id>
		<name>1Q27</name>
	</book>
	<book>
		<id>1QSa</id>
		<name>1Q28a</name>
	</book>
	<book>
		<id>1QSb</id>
		<name>1Q28b</name>
	</book>
	<book>
		<id>1QJNar</id>
		<name>1Q32</name>
	</book>
	<book>
		<id>1QMfrs</id>
		<name>1Q33</name>
	</book>
	<book>
		<id>1QLitPra</id>
		<name>1Q34</name>
	</book>
	<book>
		<id>1QLitPrb</id>
		<name>1Q34bis</name>
	</book>
	<book>
		<id>1QHfrs</id>
		<name>1Q35</name>
	</book>
	<book>
		<id>1QDana</id>
		<name>1Q71</name>
	</book>
	<book>
		<id>1QDanb</id>
		<name>1Q72</name>
	</book>

</collection>
